"papel","segmento","cotacao","ffo_yield","dividend_yield","p_vp","valor_de_mercado","liquidez","qtd_de_imoveis","preco_do_m2","aluguel_por_m2","cap_rate","vacancia_media","endereco","data_atualizacao"
"RSPD11","Residencial",1125,-2.13,5.42,1,167637000,0,0,0,0,0,0,"","2023-04-13 00:29:07"
"RURA11","Títulos e Val. Mob.",10.27,6.6,12.3,1.02,1002350000,1122970,0,0,0,0,0,"","2023-04-13 00:29:07"
"RVBI11","Títulos e Val. Mob.",71.21,11.62,12.37,0.87,102542000,187078,0,0,0,0,0,"","2023-04-13 00:29:07"
"RZAG11","Títulos e Val. Mob.",9.14,11.13,16.04,0.96,621889000,2207930,0,0,0,0,0,"","2023-04-13 00:29:07"
"RZAK11","Títulos e Val. Mob.",90.96,6.5,18.89,0.98,801165000,3045030,0,0,0,0,0,"","2023-04-13 00:29:07"
"RZAT11","Híbrido",84.06,14.16,2.51,0.84,311709000,822833,9,362.88,32.6,8.98,0,"Rodovia Washington Luis KM 198, , Corumbataí, SP, 13540-000,Av. Santos Dumont 4305, Mirassol, SP, 15135-160,Rua Professor Luciano Prata 204, São Paulo, SP, 02510-020,Av. Costa e Silva 1275, Campo Grande, MS, 79050-410,Av. Perimetral Norte 10001, Goiânia, GO, 74583-285,Rod. Juscelino Kubitscheck de Oliveira - BR 364, Frutal, MG, 38200-000,Rodovia BR 060 KM 504, Goiânia, GO, 75800-001,Rodovia BR 020 572, Caucaia, CE, 061663-015,Rodovia GO-070, Km 2 Qd. CH, Lt. 444, , Goiânia, GO, 74470-260","2023-04-13 00:29:07"
"RZTR11","Híbrido",82.98,13.76,15.95,0.86,916765000,2484550,16,1.78,0.32,18.03,0,"Zona rural de Nova Ubiratã/MT,Zona rural de Rio Verde/GO,Zona rural de Bom Jesus/PI,Zona rural de Serranópolis/GO,Zona rural de Campo Verde/MT,Zona rural de Rio Verde/GO,Zona rural de Buriticupu/MA,Zona rural de Sorriso/MT,Zona rural de Sambaíba /MA,Zona rural de Serranópolis/GO,Zona rural de Formosa do Rio Preto/BA,Zona rural de Sorriso/MT,Zona rural de Canarana/MT,Zona rural de Sorriso/MT,Zona rural de São Jose do Xingú/MT","2023-04-13 00:29:07"
"SADI11","Títulos e Val. Mob.",83.79,14.15,14.75,0.86,266470000,516213,0,0,0,0,0,"","2023-04-13 00:29:07"
"SAIC11B","Lajes Corporativas",37.88,-1.33,0,0.68,54158600,54,1,4719.94,0,0,100,"SIA Trecho 01  Lotes 630, 640, 650, 660, 670, 680, 690, 700, 710, 720, 730, 740, 750, 760, 770 e 780 - BRASÍLIA - DF","2023-04-13 00:29:07"
"SARE11","Híbrido",55.7,14.07,13.69,0.59,514352000,1253900,3,2274.34,279.4,12.29,0,"Rua Bela Cintra, 755, São Paulo - SP,Avenida Tucunaré , 720, Tamboré - CEP: 06460-020, Barueri - SP,Avenida João Pessoa, nº 500, Jardim Utinga, Cidade de Santo André  São Paulo - SP, CEP 09230-650","2023-04-13 00:29:07"
"SCPF11","Shoppings",4.92,5.33,5.14,0.42,20664000,3527,1,4229.47,793.87,18.77,23.16,"Rua Junqueira Ayres, 165 - Barris - Salvador - BA","2023-04-13 00:29:07"
"SDIL11","Logística",87.71,10.09,10.74,0.9,560910000,647913,6,1587.73,221.75,13.97,0.17,"BR 040, KM 23 - Contagem/MG,Avenida Ol 03, 200 - Duque de Caxias - RJ,Rua Prof. João Cavalheiro Salem, 1.289 Bonsucesso, Guarulhos/SP,Rodovia Índio Tibiriçá, nº 6.000,Avenida Ol 03, 200 - Duque de Caxias - RJ","2023-04-13 00:29:07"
"SDIP11","Lajes Corporativas",88,1.88,0,0.92,371533000,0,5,11500.6,391.97,3.41,8.35,"Rua Treze de Maio, nº 1.633  Bela Vista  São Paulo  SP, Rua Itapeva, nº 538  Bela Vista  São Paulo, SP,Rua James Joule, 65 - Berrini - São Paulo - SP,Av. Presidente Juscelino Kubitschek, 1830 e Rua Leopoldo Couto de Magalhês Júnior, 1461, no 28º Subdistrito - Jardim Paulista, São Paulo - SP,Rua Paes Leme, 524, no 45º Subdistrito  Pinheiros, São Paulo  SP","2023-04-13 00:29:07"
"SEED11","Híbrido",96.56,13.82,12.55,1.18,158358000,113065,0,0,0,0,0,"","2023-04-13 00:29:07"
"SEQR11","Outros",59.35,12.49,13.09,0.63,95467600,102463,4,2265.6,338.18,14.93,0,"Rua Walter Martins da Silva, nº 500, Santo Antônio da Patrula - RS, CEP 95500-000,Rua José Albino Pereira, 342, Jandira - SP, CEP 06612-001,Rua Nova York, 245, São Paulo - SP, CEP 04560-000,Rua Ewbank da Câmara, nº 48, Rio de Janeiro - RJ, CEP 21310-150","2023-04-13 00:29:07"
"SHDP11B","Shoppings",1210.05,6.92,7.22,0.94,1776100000,0,1,13433.5,1159.86,8.63,1.3,"Avenida Guilherme Campos 500, 500, Sem Complemento, Jardim Santa Genebra, Campinas/SP, Brasil, 13087-901","2023-04-13 00:29:07"
"SHOP11","Híbrido",71,-1.18,0,1.49,105170000,15,1,3845.99,221.41,5.76,18.1,"Avenida Centenario, 555, Passo Das Pedras, Gravataí/RS, Brasil, 94035-240","2023-04-13 00:29:07"
"SHPH11","Shoppings",640,7.18,6.59,0.71,389728000,88554,1,11262.3,1038.59,9.22,8.92,"Rua Dr. Veiga Filho, 133, Higienópolis, São Paulo - SP","2023-04-13 00:29:07"
"SIGR11","Títulos e Val. Mob.",100,12.82,5.34,1.02,38939500,0,0,0,0,0,0,"","2023-04-13 00:29:07"
"SNAG11","Híbrido",100.9,2.77,7.48,1.01,302700000,1085700,3,64.56,2.48,3.83,0,"Rodovia BR-163/ Sorriso - MT,Rodovia MT-130/ Primavera do Leste - MT,Rodovia MT-130/ Primavera do Leste - MT","2023-04-13 00:29:07"
"SNCI11","Títulos e Val. Mob.",93.6,9.12,15.74,0.96,393120000,795994,0,0,0,0,0,"","2023-04-13 00:29:07"
"SNCR11","Híbrido",97.8,11.85,0,0.93,176767000,0,0,0,0,0,0,"","2023-04-13 00:29:07"
"SNFF11","Títulos e Val. Mob.",82.28,7.78,11.96,0.97,232852000,423191,0,0,0,0,0,"","2023-04-13 00:29:07"
"SNLG11","Híbrido",34.61,11.43,1,0.56,65349700,35997,0,0,0,0,0,"","2023-04-13 00:29:07"
"SOLR11","Híbrido",1128.06,12.64,8.6,1.23,70935800,0,1,8828.07,1204.59,13.65,0,"Avenida Jean Khoury Farah, parte da área B, no DISTRITO DE ITAQUERA","2023-04-13 00:29:07"
"SPMO11","Híbrido",99,0.35,0.43,0.88,178965000,0,0,0,0,0,0,"","2023-04-13 00:29:07"
"SPTW11","Lajes Corporativas",38.34,19.33,12.65,0.69,68935300,115923,1,4813.53,1051.83,21.85,0,"Rua Líbero Badaró, 633/641 e Avenida, Prestes Maia, 98/114  Centro - São Paulo/ SP - Brasil","2023-04-13 00:29:07"
"SPXS11","Híbrido",78.33,3.64,5.85,0.83,96987900,245505,0,0,0,0,0,"","2023-04-13 00:29:07"
"SRVD11","Títulos e Val. Mob.",7.08,4.2,2.76,9.57,681705000,83,0,0,0,0,0,"","2023-04-13 00:29:07"
"STRX11","Híbrido",15816,0.09,0.06,106.73,2.552e+10,0,2,383093,360.31,0.09,7.89,"R. Queluzita, 34 - Fernão Dias, Belo Horizonte - MG, 31910-252,Avenida Pastor Anselmo Silvestre, 1495. Dom Joaquim. Belo Horizonte - MG.","2023-04-13 00:29:07"
"TBOF11","Lajes Corporativas",101.5,-0.11,1.02,486.34,1020080000,0,1,0,0,0,15.37,"Avenida Jornalista Roberto Marinho, 85, Sem Complemento, Cidade Monções, São Paulo/SP, Brasil, 04576-010","2023-04-13 00:29:07"
"TEPP11","Lajes Corporativas",69.83,2.37,8.49,0.73,294820000,654808,5,9126.02,391.97,4.3,8.35,"Av. Presidente Juscelino Kubitschek, 1830 e Rua Leopoldo Couto de Magalhês Júnior, 1461, no 28º Subdistrito - Jardim Paulista, São Paulo - SP,Rua Paes Leme, 524, no 45º Subdistrito  Pinheiros, São Paulo  SP,Rua Treze de Maio, nº 1.633  Bela Vista  São Paulo  SP, Rua Itapeva, nº 538  Bela Vista  São Paulo, SP,Rua James Joule, 65 - Berrini - São Paulo - SP","2023-04-13 00:29:07"
"TGAR11","Híbrido",108.8,7.91,17.25,0.83,1499750000,4003010,4,64.71,1.63,2.52,0,"Rodovia GO-060, s/n, Turvânia- GO,Rodovia dos Romeiros, s/n, Trindade-GO,Avenida 85, 603, Goiânia - GO, 74823-310,Rodovia GO-060, s/n, Turvânia- GO","2023-04-13 00:29:07"
"THRA11","Lajes Corporativas",138.5,2.96,0,14.52,203973000,0,0,0,0,0,0,"Av. Engenheiro Luis Carlos Berrini, 105, São Paulo, SP","2023-04-13 00:29:07"
"TJKB11","Lajes Corporativas",262.5,10.82,0,0.98,198706000,6652,7,7819.99,888.66,11.36,0,"Rua Vilela, 800, Tatuapé, São Paulo - SP,Rua Tabapuã, 500,Avenida Conselheiro Rodrigues Alves, 300, Vila Mariana, São Paulo - SP,Rua Marselhesa, 700, Vila Mariana, São Paulo - SP,Avenida Brasil, 350, Jardim Paulista, São Paulo - SP,Rua Pasquale Gallupi,7, Morumbi, São Paulo - SP,Avenida Adolfo Pinheiro, 2366, Santo Amaro, São Paulo - SP","2023-04-13 00:29:07"
"TORD11","Híbrido",3.88,6.15,20.63,0.28,135999000,461414,0,0,0,0,0,"","2023-04-13 00:29:07"
"TOUR11","Residencial",8.8,0,0,0,0,0,3,0,0,0,0,"Rua das Palmeiras, nº677, CEP 09080-160, Santo André, SP.,Rua Doutor Romulo Pasqualini, s/n, CEP 08820-310, Mogi das Cruzes, SP.,Rua Carmo do Rio Verde, nº109, CEP 04729-010, São Paulo, SP.","2023-04-13 00:29:07"
"TRNT11","Lajes Corporativas",100,4.73,4.64,0.51,393556000,21160,1,6237.1,545.82,8.75,41.63,"Avenida Das Nacoes Unidas, 12901, Sem Complemento, Brooklin Paulista, São Paulo/SP, Brasil, 04578-910","2023-04-13 00:29:07"
"TRXB11","Híbrido",122,7.57,8.91,1.06,333122000,500991,12,3556,456.51,12.84,0,"Cidade de Teresina/Piauí,Paulo Afonso/BA, Avenida Milão  Quadra 50/51  Lotes 1, 1/15 e 1/19  Jardim Europa  Goiânia/GO,Avenida Assis Chateaubriand, nº 1.110  Bairro Liberdade  Campina Grande/PB,Rodovia Amaral Peixoto, s/n  Jardim Campomar  Rio das Ostras/RJ,Avenida Independência, s/n, Setor Central  Goiânia/GO,Dourados/MS, Rua México, nº 160  Centro  Araruama/RJ,Avenida Presidente Kennedy, nº 501  São Cristóvão  Teresina/PI,Jequié/BA,Avenida Padre Orlando de Morais, nº 2.147  Parque Amazônia  Goiânia/GO,Bauru/SP","2023-04-13 00:29:07"
"TRXF11","Híbrido",103.2,7.14,10.24,1,1237650000,2763790,26,3466.53,358.94,10.35,0,"Av. Antônio Carlos C de Barros, 365  Vila José Lório,Avenida Guadalajara, s/nº - Jardim Glória,Av. Epitacio Pessoa, S/N, Gleba C - Alto da Alianca, Juazeiro - BA,Rua Dr. Ademar de Barros, 50  Jardim Europa,Av. Waldemar Alves, 230 - São Vicente, Araçatuba - SP, 16050-005,Avenida Bady Bassitt, 5.300,Av. Waldemar Alves, 230 - São Vicente, Araçatuba - SP, 16050-005,Avenida Prof. João Fiusa, S/N  Jardim Canada ,Avenida Senador Saraiva, 835,Praça Tuím  Lote 02  Quadra 206,Avenida Maria Servidei Demarchi, 1897  Demarchi,Av. Dr. Ulisses Guimarães, 423 - Jardim Amazonas, Petrolina - PE,Av. Gov. Jorge Teixeira, 3500 - Industrial, Porto Velho - RO, 76821-064,Avenida Dr. José Ramon Urtiza, 1000  Panamby,Rua Aricambú, 65 - Cordovil - Rio de Janeiro - RJ,Avenida Marte, 624  Alphaville ,Avenida José Paulino, nº 2.600,Av. Presidente Vargas, S/N - Vila da Saúde,Rodovia Federal BR-222, S/N° - Tabapuá  Caucaia - CE ,Avenida Padre Anchieta, 4.580  Vila Vermelha,Av. Barreto de Menezes, 800 - Piedade, Jaboatão dos Guararapes - PE - Loja 05,Rua das Figueiras, nº 1.021  Operário,Avenida José Júlio da Costa, s/n - Ferroviários - MG,Rua Maranhão, 975  Santa Paula,Avenida Regente Feijó, nº 823,Avenida Prof. João Fiusa, S/N  Jardim Canada","2023-04-13 00:29:07"
"TRXL11","Híbrido",103.38,4.66,0,1.05,2177900000,0,20,4369.29,185.81,4.25,0.51,"Estrada Do Capuava, 1000, Chacara Ondas Verdes, Cotia/SP, Brasil, 06715-725,Rua Ronald Cladstone Negri, 557, Polo De Alta Tecnologia De Campinas Polo I, Campinas/SP, Brasil, 13069-472,Rodovia Ba535 Via Parafuso, Km 14, Cep 42849-000, Polo Logístico, Camacari/BA, Brasil, 42800-331,Br 116, 2271, Verife, Itaitinga/CE, Brasil, 61880-000,Rodovia Dom Gabriel Paulino Bueno Couto, Km 80,2, Esquina Com Via Dos Ipes, Bairro Do Jacaré, Cabreuva/SP, Brasil, 13315-000,Avenida Charles Goodyear, S/n, Cururuquara, Santana De Parnaiba/SP, Brasil, 06524-115,Rodovia Marechal Rondon, Km 536, 21500, Avenida, Aracatuba/SP, Brasil, 16027-231,Avenida Beirario, 5777, Distrito Industrial Deputado Simao Da Cunha, Santa Luzia/MG, Brasil, 33040-260,Rodovia Anhanguera, S/n, Km 308, Parque Residencial Candido Portinari, Ribeirao Preto/SP, Brasil, 14093-500,Rodovia Br470, 04, Machados, Navegantes/SC, Brasil, 88373-330,Avenida Alberto Soares Sampaio, S/n, Capuava, Maua/SP, Brasil, 09380-000,Avenida Francisco Roveri, S/n, Parque Almerinda Pereira Chaves, Jundiai/SP, Brasil, 13212-541,Rua Perola, 350, N/a, Jardim Santa Esmeralda, Hortolandia/SP, Brasil, 13186-546,Rua Dona Catharina Maria De Jesus, 400, Bonsucesso, Guarulhos/SP, Brasil, 07175-500,Estrada De Sao Goncalo, S/ Nº, Altura Aproximada Do Km 530, Humildes , Feira De Santana/BA, Brasil, 44135-000,Avenida Brigadeiro Faria Lima, 186, Pinheiros, Sao Paulo/SP, Brasil, 05426-200,Estrada Municipal Thereza Thomazella, 432, Bairro Dos Pires, Extrema/MG, Brasil, 00037-640,Estrada Ferreira Guedes, 784, Potuvera, Itapecerica Da Serra/SP, Brasil, 06885-150,Largo De Santana, 780, Santana, Sao Paulo/SP, Brasil, 02402-003,Estrada Rio Douro, 800, Mantiquira, Duque De Caxias/RJ, Brasil, 25245-810","2023-04-13 00:29:07"
"TSER11","Lajes Corporativas",100,11.17,11,1.01,120500000,57888,1,2656.07,222.01,8.36,0,"Alameda Araguaia, nº 2550 e Avenida Marcos Penteado de Ulhôa Rodrigues, nº 939  Alphaville","2023-04-13 00:29:07"
"TSNC11","Híbrido",0.01,95080,1.04026e+11,0,10868,0,2,0.69,779.45,113441.49,0,"Rua Castro Delgado, 188, Sem Complemento, Alto De Pinheiros, Sao Paulo/SP, Brasil, 05465-010,Avenida General Valdomiro De Lima, 508, Sem Complemento, Jabaquara, Sao Paulo/SP, Brasil, 04344-070","2023-04-13 00:29:07"
"UBSR11","Títulos e Val. Mob.",102.5,11.8,0,1.08,2710270000,0,0,0,0,0,0,"","2023-04-13 00:29:07"
"URPR11","Outros",89.4,7.35,18.88,0.9,1043770000,3105780,0,0,0,0,0,"","2023-04-13 00:29:07"
"VCJR11","Títulos e Val. Mob.",86.23,12.25,12.93,0.91,1269650000,1623690,0,0,0,0,0,"","2023-04-13 00:29:07"
"VCRA11","Títulos e Val. Mob.",100.15,4.75,12.31,0.98,460081000,627932,0,0,0,0,0,"","2023-04-13 00:29:07"
"VCRI11","Títulos e Val. Mob.",7.89,12.12,17.29,0.83,140231000,354343,0,0,0,0,0,"","2023-04-13 00:29:07"
"VCRR11","Logística",70.01,12.1,11.37,0.55,140020000,134844,4,2272.19,125.02,5.5,0,"Prof Ascendido Reis, 1300 - Vila Clementino/SP,Rua Loefgreen, 2527 - Vila Clementino/SP,Rua Gregório Serrão, 232 - Vila Mariana/SP,Rua Carlos Petit, 215 - Vila Mariana/SP","2023-04-13 00:29:07"
"VERE11","Outros",257,13.31,12.53,0.77,146757000,0,4,972.84,167.36,17.2,16.52,"Av. Wilson Tavares Ribeiro, 1400, Condomínio de galpões logísticos no Condomínio de Galpões Sindi Investimentos, Contagem-MG,Rua Benjamin Jacob, 10, CEP 30430-290, Belo Horizonte-MG,Av. Dom Pedro II, 1900, CEP 30710-010, Belo Horizonte-MG,Av. Wilson Tavares Ribeiro, 1400, Contagem-MG","2023-04-13 00:29:07"
"VGHF11","Híbrido",8.67,8.95,14.91,0.95,631950000,2224440,0,0,0,0,0,"","2023-04-13 00:29:07"
"VGIA11","Títulos e Val. Mob.",9.89,8.37,18.06,1.04,722790000,4861570,0,0,0,0,0,"","2023-04-13 00:29:07"
"VGIP11","Títulos e Val. Mob.",79.81,11.27,14.72,0.88,940740000,2056270,0,0,0,0,0,"","2023-04-13 00:29:07"
"VGIR11","Títulos e Val. Mob.",9.52,10.04,15.53,0.99,982661000,4070650,0,0,0,0,0,"","2023-04-13 00:29:07"
"VIFI11","Títulos e Val. Mob.",6.59,20.71,11.13,0.77,53307800,61203,0,0,0,0,0,"","2023-04-13 00:29:07"
"VILG11","Logística",88.42,8.81,9.27,0.79,1326070000,2425260,16,2281.54,246.79,10.82,9.71,"Rodovia Br 316 - KM 23/24
Bairro Campestre - Benevides/PA,Cidade de Eldorado do Sul, na Av. Industrial Belgraf, n° 765 - RS,Avenida das Quaresmeiras, n. 200, Pouso Alegre - MG,Rodovia Armínio Guilherme, 82  Ipojuca, PE,Cidade Cachoeirinha, Rio Grande do Sul, RS 118, nº 12760,R. Almerim, 100, Guarulhos - SP,Rua Kida, 191 - Guarulhos - São Paulo, Rodovia BR-493 (RioMagé), km 3,5, Duque de Caxias - RJ,Rodovia Fernão Dias, km 891,5, Extrema - MG,Av. Dr. Kenkiti Shimomoto, Nº 1.678, Osasco - SP,Rodovia Castello Branco, km 57, em São Roque, SP,Est. Vargem do João Pinto, Fazenda Matão Gleba 2, Extrema - MG,Cidade de Cariacica, n° 10.288, km 290, RD. Governador Mario Covas - ES,Município de Serra, no estado do Espírito Santo,Rodovia Fernão Dias, km 933, Extrema - MG,Av. Marginal Rodovia dos Bandeirantes, Nº 800, Jundiaí - SP","2023-04-13 00:29:07"
"VINO11","Lajes Corporativas",40.25,10.26,9.84,0.74,666752000,976419,10,10292.9,1134.6,11.02,2.07,"Largo do Ibam, 1, Humaitá, Rio de Janeiro/RJ,Rua Evandro Carlos de Andrade, 160, São Paulo - SP,Rua Haddock Lobo, nº 347, São Paulo - SP,Rua Jaceru, 154, Vila Gertrudes, São Paulo/SP,Rua Corá, 2175, São Paulo/SP,Rua Mourato Coelho, 1404, na Vila Madalena, São Paulo/SP.,Alameda Araguaia, 617, Alphaville, Barueri/SP,Av. Bartolomeu Mitre, 336 CEP: 22.431-002 Rio de Janeiro - RJ - Brasil,Rua Oscar Freire, 585, Jardim Paulista, São Paulo/SP,Rua Cardeal Arcoverde nº 563, São Paulo - SP","2023-04-13 00:29:07"
"VISC11","Shoppings",104.27,7.95,8.63,0.84,1938490000,2140600,20,3137.7,280.05,8.93,5.43,"Av. Prefeito Chiquilito Erse, 3288 - Porto Velho/RO,Trav. Padre Eutíquio, 1078  Belém - PA,Av. Historiador Rubens de Mendonça (Av. CPA), 3300 - Cuiabá/MT,Estrada do Mendanha, 450 / 550 e 555  Rio de Janeiro  RJ,Av. Madre Benvenuta, 687 - Santa Mônica, Trindade - Florianópolis - SC,Avenida Governador Agamenon Magalhães, 153 - Sto Amaro, Recife - PE,Avenida Coronel Fernando Ferreira Leite nº 1.540 - Ribeirão Preto/SP,Avenida Doutor Olivio Lira, 353 - Praia da Costa, Vila Velha/ES,Avenida Luiz Viana, 8544 - Salvador - BA,Av. Washington Soares, 85 - Edson Queiroz, Fortaleza - CE,Rodovia Raposo Tavares, 23.500 - Lageadinho, Cotia-SP ,Av. Carlos Jereissati, 100 - Maracanaú/CE,Rua Comendador Araujo, 731 - Curitiba - PR,Av. Cristiano Machado, 4000 - União - Belo horizonte - MG,Rua Barão de São Francisco, 236 - Rio de Janeiro/RJ,Av. Maestro Paulo e Silva, 400 - Rio de Janeiro - RJ,Av. Pereira Barreto, 42 - Santo André - SP,Avenida Geremario Dantas, 404 - Rio de Janeiro - RJ,Av. Manoel Goulart, 2400 - Jardim das Rosas - Presidente Prudente - SP,Rua Jacy Teixeireira de Camargo, 940 - Campinas/SP","2023-04-13 00:29:07"
"VIUR11","Outros",6.29,14.9,13.65,0.69,169492000,318307,8,2438.17,307.58,12.62,0,"Rua Candido Benício, 1671, Jacarepaguá, Rio de Janeiro - RJ,Estrada Municipal UNICAMP-Telebrás km 1, Cidade Universitária, Campinas - SP,Rua Luis Otavio, 1.313, Taquaral, Campinas - SP,Rua Candido Benício, 1671, Jacarepaguá, Rio de Janeiro - RJ,Rua Oswaldo Cruz (Rua Grande), 415, Centro, São Luis  MA,Rua Santos Dumont, 888, Niterói, Canoas - RS,Avenida Dr. Cardoso de Melo, 1.200, Vila Olímpia, São Paulo - SP,Rua Orfanotrofio, 555, Porto Alegre, Porto Alegre - RS","2023-04-13 00:29:07"
"VLOL11","Lajes Corporativas",94.5,7.5,7.05,0.94,168666000,67946,1,13431.4,1340.16,9.98,0,"Rua Fidêncio Ramos, 302, Vila Olímpia, 04551-010, São Paulo - SP","2023-04-13 00:29:07"
"VOTS11","Títulos e Val. Mob.",85.15,22.1,15.05,0.91,70496800,9040,0,0,0,0,0,"","2023-04-13 00:29:07"
"VRTA11","Títulos e Val. Mob.",81.77,13.4,15.18,0.9,1274990000,2122120,0,0,0,0,0,"","2023-04-13 00:29:07"
"VSEC11","Títulos e Val. Mob.",2.91,-76.11,11.16,0.07,182559,177,0,0,0,0,0,"","2023-04-13 00:29:07"
"VSHO11","Shoppings",63.92,10.64,11.46,0.64,134155000,49819,3,1746.41,352.92,20.21,7.84,"R. Paiquerê, 200 - Jardim Paiquere, Valinhos - SP,Av. Visconde do Rio Branco, 360 - Centro, Niterói - RJ,Remanso Campineiro, Hortolândia - SP","2023-04-13 00:29:07"
"VSLH11","Outros",4.91,17.5,24.81,0.47,146633000,763415,0,0,0,0,0,"","2023-04-13 00:29:07"
"VTLT11","Logística",90.15,11.38,11.11,0.89,190667000,184205,1,742.21,95.7,12.89,0,"Avenida Prefeito Domingos Mocelin Neto s/n, Borda do Campo, Quatro Barras, PR","2023-04-13 00:29:07"
"VVPR11","Híbrido",101.5,8.99,4.68,1.04,234036000,0,6,5334.39,526.7,9.87,0,"Avenida Beirario, 5777, Sem Complemento, Distrito Industrial Deputado Simao Da Cunha, Santa Luzia/MG, Brasil, 33040-260,Estrada De Sao Goncalo, S/ Nº, Altura Aproximada Do Km 530, Humildes , Feira De Santana/BA, Brasil, 44135-000,Estrada Do Capuava, 1000, Sem Complemento, Chacara Ondas Verdes, Cotia/SP, Brasil, 06715-725,Rodovia Ba535 Via Parafuso, Km 14, Cep 42849-000, S/n, Cep Correto: 42849-000, Polo Logístico, Camacari/BA, Brasil, 42800-331,Avenida Brigadeiro Faria Lima, 186, Sem Complemento, Pinheiros, Sao Paulo/SP, Brasil, 05426-200,Rua Ronald Cladstone Negri, 557, Sem Complemento, Polo De Alta Tecnologia De Campinas Polo I, Campinas/SP, Brasil, 13069-472","2023-04-13 00:29:07"
"VXXV11","Outros",1001,-0.49,0,1.01,265547000,1252930,0,0,0,0,0,"","2023-04-13 00:29:07"
"WHGR11","Híbrido",8.35,7.68,11.13,0.84,209498000,543200,0,0,0,0,0,"","2023-04-13 00:29:07"
"WPLZ11","Shoppings",62.99,8.29,8.67,0.72,64296900,2507,1,1701.46,154.97,9.11,11.45,"Av. Francisco Matarazzo s/n, Bloco B, São Paulo, SP","2023-04-13 00:29:07"
"WSEC11","Títulos e Val. Mob.",91.5,3.26,7.89,0.91,22477100,24015,0,0,0,0,0,"","2023-04-13 00:29:07"
"WTSP11B","Híbrido",34.9,-14.71,3.53,0.48,34640500,547,1,2839.48,119.48,4.21,5.97,"Av. das Nações Unidas, 12551, 12555 e 12559","2023-04-13 00:29:07"
"XPCA11","Títulos e Val. Mob.",9.76,4.99,16.34,1.03,306369000,1433970,0,0,0,0,0,"","2023-04-13 00:29:07"
"XPCI11","Títulos e Val. Mob.",80,8.32,13.85,0.88,696124000,1750400,0,0,0,0,0,"","2023-04-13 00:29:07"
"XPCM11","Lajes Corporativas",12.35,15.94,14.18,0.28,29819900,57425,1,1348.98,0,0,85,"Av Pr Aristeu Ferreira da Silva,370,Cavaleiros,Macaé-RJ","2023-04-13 00:29:07"
"XPHT11","Hotel",104.2,4.69,11.19,1.06,396444000,59114,12,19427.4,1028.64,5.29,41.99,"Av. Rocha Pombo, 2600 - Águas Belas, São José dos Pinhais - PR,Avenida Severo Dullius, 2055 - Anchieta - Porto Alegre - RS,Av. Republica Argentina, 1834 - Vila Maracanã - Foz do Iguaçu - PR,R. Mathias Velho, 235 - Centro, Canoas - RS,Rua Paulo Zimmermann, 142 - Centro - Blumenau - SC,Rua Dr. Pedrosa, 288 - Centro - Curitiba - PR,R. Eduardo Viana, 163 - Barra Funda, São Paulo - SP,Av. Mariano Torres, 927 - Centro, Curitiba - PR,R. Joinville, 515 - Ibirapuera - São Paulo - SP,Rua Garibaldi, 633 - Floresta - Porto Alegre - RS,Av. Martiniano do Valle Filho, 355 - Londrina - PR,Av. São Pedro, 2300 - Engenho Braun - Chapecó - SC","2023-04-13 00:29:07"
"XPIN11","Outros",69.31,9.93,10.8,0.67,495596000,420280,100,1926.33,201.44,10.46,0,"Rua Kanebo, 175, bairro Distrito Federal,Rua Kanebo, 175, bairro Distrito Federal,Rod Dom Pedro I, km 87,5, Ponte Alta, 12954-273,Estrada Municipal Alberto Tofanin, km 5,5, Bairro do Pinhal,Rod Dom Pedro I, km 87,5, Ponte Alta, 12954-261,Rodovia Dom Pedro I, km 90,Rua Kanebo, 175, bairro Distrito Federal,Rua Kanebo, 175, bairro Distrito Federal,Estrada Municipal Alberto Tofanin, km 5,5, Bairro do Pinhal,Rod Dom Pedro I, km 87,5, Ponte Alta, 12954-275,Avenida Tégula, 888, bairro Ponte Alta,Estrada Municipal Antonio Agostinho Barbosa, nº 1300, Gleba ""B"", CEP 37640-000,Rod Dom Pedro I, km 87,5, Ponte Alta, 12954-261,Rua Kanebo, 175, bairro Distrito Federal,Rod Dom Pedro I, km 87,5, Ponte Alta, 12954-261,Rod Dom Pedro I, km 87,5, Ponte Alta, 12954-275,Av. Tégula, 888, Ponte Alta, 12952-824,Av. Tégula, 888, Ponte Alta, 12952-821,Estrada Municipal Alberto Tofanin, km 5,5, Bairro do Pinhal, Atibaia / Jarinú, SP
Estrada Municipal Al,Rua Kanebo, 175, bairro Distrito Federal,Rodovia Anhanguera, km 61 - Bairro castanho,Rod Dom Pedro I, km 87,5, Ponte Alta, 12954-275,Estrada Municipal Alberto Tofanin, km 5,5, Bairro do Pinhal,Av. Tégula, 888, Ponte Alta, 12952-824,Avenida Tégula, 888, Atibaia - SP, CEP: 12952-820,Rodovia Dom Pedro I, km 90,Rua Kanebo, 175, bairro Distrito Federal,Rua Kanebo, 175, bairro Distrito Federal,Rod Dom Pedro I, km 87,5, Ponte Alta, 12954-275,Estrada Municipal Alberto Tofanin, km 5,5, Bairro do Pinhal,Rod Dom Pedro I, km 87,5, Ponte Alta, 12954-261,Avenida Tégula, 888, bairro Ponte Alta,Rua Kanebo, 175, bairro Distrito Federal,Rua Kanebo, 175, bairro Distrito Federal,Rod Dom Pedro I, km 87,5, Ponte Alta, 12954-277,Estrada Municipal Alberto Tofanin, km 5,5, Bairro do Pinhal,Rod Dom Pedro I, km 87,5, Ponte Alta, 12954-261,Rodovia Dom Pedro I, km 90,Rua Kanebo, 175, bairro Distrito Federal,Rua Kanebo, 175, bairro Distrito Federal,Estrada Municipal Alberto Tofanin, km 5,5, Bairro do Pinhal,Rod Dom Pedro I, km 87,5, Ponte Alta, 12954-261,Estrada Luiz Lopes Neto, 738, Extrema - MG, CEP: 12954-260,Rua Kanebo, 175, bairro Distrito Federal,Rua Kanebo, 175, bairro Distrito Federal,Rod Dom Pedro I, km 87,5, Ponte Alta, 12954-261,Rod Dom Pedro I, km 87,5, Ponte Alta, 12954-275,Av. Tégula, 888, Ponte Alta, 12952-824,Av. Tégula, 888, Ponte Alta, 12952-820,Estrada Municipal Alberto Tofanin, km 5,5, Bairro do Pinhal, Atibaia / Jarinú, SP
Estrada Municipal Al,Rua Kanebo, 175, bairro Distrito Federal,Rodovia Anhanguera, km 61 - Bairro castanho,Rod Dom Pedro I, km 87,5, Ponte Alta, 12954-275,Estrada Municipal Alberto Tofanin, km 5,5, Bairro do Pinha,Av. Tégula, 888, Ponte Alta, 12952-824,Avenida Tégula, 888, Atibaia - SP, CEP: 12952-820,Rodovia Dom Pedro I, km 90,Rua Kanebo, 175, bairro Distrito Federal,Rodovia Anhanguera, km 61 - Bairro castanho,Rod Dom Pedro I, km 87,5, Ponte Alta, 12954-275,Estrada Municipal Alberto Tofanin, km 5,5, Bairro do Pinhal,Rod Dom Pedro I, km 87,5, Ponte Alta, 12954-261,Avenida Tégula, 888, bairro Ponte Alta,Rua Kanebo, 17","2023-04-13 00:29:07"
"XPLG11","Logística",93.99,8.86,9.14,0.83,2547230000,3273240,17,1982.68,179.43,9.05,6.28,"Rod. dos Bandeirantes, km 34,Rod. dos Bandeirantes, km 34 - Cajamar, SP,ROD BR101, Sul Nº 2.220 - Cabo de Santo Agostinho, PE,km 26 + 175,35m e o km 25 + 759,35m da Rodovia Anhanguera,Avenida Osvaldo José do Amaral, SN - Areias São José - SC,Bairro dos Tenentes no Município de Extrema/MG ,Estrada Miguel Pereira nº 34, Bairro São Miguel, CEP: 23.890-000,Via Jose Luiz Galvão, 1905 - Ribeirão Preto - SP,Avenida OL-1 -Duque de Caxias, RJ,Estrada Tenente Marques, 1818 - Santana de Parnaiba - SP,Rod. dos Bandeirantes, km 34 - Cajamar, SP,Bairro dos Tenentes no Município de Extrema/MG ,Rua Lennie Queiroz, 333 - Cachoeirinha - RS,Rua Joao de Padula, 245 - Americana - SP,Avenida Ceci, 1649 - Barueri - SP,ROD BR101, Sul Km 96,4, 5.225 - Cabo de Santo Agostinho, PE,Estrada Municipal do Mandu, 2550 - Itapeva - MG","2023-04-13 00:29:07"
