"papel","segmento","cotacao","ffo_yield","dividend_yield","p_vp","valor_de_mercado","liquidez","qtd_de_imoveis","preco_do_m2","aluguel_por_m2","cap_rate","vacancia_media","endereco","data_atualizacao"
"AAZQ11","Títulos e Val. Mob.",9.56,0.6,5.15,0.99,229796000,638794,0,0,0,0,0,"","2023-04-21"
"ABCP11","Shoppings",68,23.29,8.8,0.74,320218000,53904,1,4189.77,1294.47,30.9,2.76,"Avenida Industrial, 600, Centro, Santo André - SP","2023-04-21"
"AEFI11","Outros",174.9,7.49,0,1.21,411893000,0,8,3763.21,286.88,7.62,0,"Rua da Consolação, nºs 2.320 e 2.322 - São Paulo/SP,Av. Dr. Rudge Ramos, nº 1.501 - São Bernardo do Campo/SP,Rua Jequitibá, 401, Horto - Ipatinga/MG,Avenida Presidente Juscelino Kubitschek, n° 227/229 e 247, Centro - Betim/MG,Rua Senador Fláquer, 456 - Centro - Santo André-SP,Avenida Beira Rio, 3.001, Jardim Europa - Cuiabá/MT,Avenida São Luís Rei de França, 32, Turu - São Luís/MA,Rua Timbiras, 1387, Funcionários - Belo Horizonte/MG","2023-04-21"
"AFCR11","Híbrido",103.15,11.23,0,0.99,186437000,0,0,0,0,0,0,"","2023-04-21"
"AFHI11","Títulos e Val. Mob.",92.3,9.58,14.66,0.97,278696000,625614,0,0,0,0,0,"","2023-04-21"
"AFOF11","Títulos e Val. Mob.",91.6,12.45,5.74,1.02,63313200,0,0,0,0,0,0,"","2023-04-21"
"AGCX11","Outros",1235.5,0.9,0,11.43,14317200000,0,79,106619,1108.16,1.04,6.97,"Av. Rio Branco, 311-B - Rio de Janeiro - RJ,Est. Rio do A, 1131 - Campo Grande - RJ,Av. do Cursino, nº 1348 - São Paulo - SP,R. Pedro Vicente, 222 - São Paulo - SP,Av. do Imperador, 3892 - São Paulo/SP,Rua Alves Guimarães, nº 50, Pinheiros - SP,Rua Oscar Freire, 585, Jardins,Rua Floriano Peixoto 00915 - CE,Rua João de Almeida, 72 - RJ,Av Eng. Luiz Carlos Berrini, 1307 - SP,Av. Rio Branco, nº 1.675 - loja - São Paulo - SP,Rua Visconde de Pirajá, nº 127 - Rio de Janeiro - RJ,Avenida das Esmeraldas, 512 - Osasco - SP,Rua das Palmeiras, nº 233 - loja - São Paulo - SP,EQ 406/407-SUL  Lote 1 - Brasília - DF,Av. Brigadeiro Faria Lima, 2232,Praça Tiradentes, 85 - MG,Rua Buenos Aires, 48 - RJ,Av Paulista 447 Loja - SP,Av. Sto. Amaro, 3332 - SP,Estrada de Taipas, 355 - São Paulo/SP,Rua Salvador Gianetti, nº 436 - São Paulo - SP,Rua Paes Leme, 250/258 - São Paulo - SP,Av. Indianópolis, nº 2.125 - São Paulo - SP,Via Anchieta, nº 1.558 - São Paulo - SP,Rua Santa Filomena, nºs 677, 687 e 697, Centro - SBC - SP,R. Marechal Deodoro - SP,Av. Liberdade, 151 - SP,Av. Mateo Bei 3286 - SP,Rua 7 de Setembro, 1100 - RS,Av. Marechal Câmara, nº 160 - Rio de Janeiro - RJ,Rua Sesefredo Klein Doll, 12 - Embu-Guaçu - SP,Av. Maria Luiza Americano, 1688 - São Paulo/SP,Lg. Páteo do Colégio, 1 - São Paulo - SP,Av. Mateo Bei, 413 - São Paulo/SP,Estrada do Pernambuco, nº 500 - Guarujá - SP,Av. Afrânio de Melo Franco, 131 - Leblon - RJ,Rua Pedro I 00373 - CE,Praça Visconde de Mauá, 20 - SP,Av. Senador Queiroz, nº 85 a 111 - Lj 4 e 5 - São Paulo - SP,Rua Mariz e Barros, nº 79 - Rio de Janeiro - RJ,Av. Imirim, nº 1.271 - São Paulo - SP,Rua Dias da Cruz, nº 28-A - Rio de Janeiro - RJ,Av. 1, 500  Rio Claro - SP,Av. Paulista, 1.227,Rua Haddock Lobo, 1573, Jardins,Av. João Pinheiro, 500 - MG,Av. Rio Branco, 115 - RJ,Av. Cons. Rodrigues Alves, 53 - SP,Praça Pio X, 78 - RJ,R. Cel. Souza Franco, 115 - Suzano - SP,R. Santos Dumont, 599 - Ferraz de Vasconcelos/SP,Alameda Santo Ângelo, 118 - Mogi das Cruzes - SP,Rua Guerino Giovani Leardini, nº 63/67 - São Paulo - SP,Av. Senador Queiroz, nº 85 a 111 - Lj 1 a 3 - São Paulo - SP,Rua Desembargador Góes Cavalcante, nº 261 - Recife - PE,Av. Duque de Caxias - SP,R Barao de Jundiai 884 - SP,Rua Dr. Feliciado Sodré, 111 - RJ,Av. Paulista, 726 - L1 - SP,Estrada de Itapecerica, nº 3.429 - São Paulo - SP,Rua dos Italianos, 609 - São Paulo - SP,Av. Marechal Floriano Peixoto, nº 2.370 - N Iguaçu - RJ,Rua Dr. Nilo Peçanha, nº 125 - São Gonçalo - RJ,Av. Barão de Itapura, nº 2233 - Campinas - SP,Rua 12, 239 - RJ,Rua. Sem. Flaquer, 305 - SP,Est. do Campo Limpo, 5520 - São Paulo - SP,Av. República do Chile, nº 230 - Rio de Janeiro - RJ,Av. de Pinedo, nº 228 - São Paulo - SP,Rua Antônio Vieira, nº 24 - Loja A - Rio de Janeiro - RJ,Av. das Américas, nº 15.545 - Rio de Janeiro - RJ,Av. Santa Catarina, 287 - São Paulo - SP,Av. Padre Antônio Jose Dos Santos, nº 872 - São Paulo - SP,Av. Paulista, 436 - SP,R Mal Deodoro 195 - PR,Rua Imp. Dom Pedro II, 255 - P","2023-04-21"
"AGRX11","Híbrido",10.76,7.36,9.53,1.04,69243200,103540,0,0,0,0,0,"","2023-04-21"
"AIEC11","Lajes Corporativas",59.8,15.36,14.73,0.63,288534000,385713,2,12225.1,2260.9,18.49,0,"Avenida das Nações Unidas, 14.171 - Chucri Zaidan - São Paulo - SP,Avenida Presidente Wilson, 118 - Centro - Rio de Janeiro - RJ","2023-04-21"
"ALMI11","Lajes Corporativas",774,2.05,0,0.38,86051000,21206,1,1898.99,171.58,9.04,97.07,"Avenida Almirante Barroso, 81, Sem Complemento, Centro, Rio De Janeiro/RJ, Brasil, 20031-004","2023-04-21"
"ALZM11","Títulos e Val. Mob.",82.98,13.74,9.44,0.93,57355100,118332,0,0,0,0,0,"","2023-04-21"
"ALZR11","Híbrido",113.9,7.18,12.22,1.08,788519000,1113110,13,3625.74,289.29,7.98,0,"Av. Presidente Wilson s/n.º 6000, São Paulo, SP, 03107-002,Rua Padre Adelino, 758, Quarta Parada, São Paulo/SP, Brasil, 03303-000,Rua Pacheco Leao, 70, Jardim Botânico, Rio De Janeiro/RJ, Brasil, 22460-030,Avenida Professor Ascendino Reis, 545, Vila Clementino, Sao Paulo/SP, Brasil, 04027-000,Rua Barão De Penedo, 238, P1, P13 e P14, Guarulhos/SP, Brasil, 07222-015,Rua Fritz Reiman, 628, Itapegica, Guarulhos, SP, 02236-040,Avenida Dom Hélder Câmara, 3.203 e 3.229, Del Castilho, Rio De Janeiro/RJ, Brasil, 21050-624,Avenida Duquesa De Goias, 381, Real Parque, Sao Paulo/SP, Brasil, 05686-001,Rua José Monfardini 3845, Lote A, Espírito Santo do Pinhal, SP, 13990-000,Avenida Nações Unidas, 51 - 15, Jardim Godoy, Bauru/SP, Brasil, 17021-365,Rua Arapore, 655, Jardim Guedala, São Paulo/SP, Brasil, 05608-001,Avenida Sumaré, 1500, Perdizes, Sao Paulo/SP, Brasil, 05016-110,Avenida dos Estados, S/N, Vila Metalúrgica, na Cidade de Santo André, São Paulo, 09220-570","2023-04-21"
"ANCR11B","Shoppings",3450,9.69,4.45,1,1556340000,0,5,7823.6,997.41,12.75,4.42,"Av. Cristiano Machado, nº 4000, Belo Horizonte/MG,Av. Praia de Botafogo, 400 - Botafogo, Cep: 22250-040 - Rio de Janeiro - RJ - Brasil.,Av. Abílio Augusto Távora, 1111 - Luz, Nova Iguaçu - RJ,Conjunto A, T137 - Asa Norte - Distrito Federal - Brasília - DF - Brasil. CEP: 70077-900,Av. Deputado Benedito Matarazzo, 9403 - Jardim Oswaldo Cruz - São José dos Campos - SP","2023-04-21"
"APTO11","Híbrido",8.4,14.97,15.17,0.84,33708000,68668,6,12951,1001.32,7.73,0,"Rua Leopoldo Couto de Magalhães Júnior nº1098 e Rua Lopes Neto nº390, 28º Subdistrito - Jardim Paulista, São Paulo - SP,Alameda Fernão Cardim, 70 e 72  Jardim Paulista  Estado
de São Paulo,Rua do Rócio nº 423 e Rua Fidêncio Ramos nº 420, no 28º Subdistrito - Jaridm Paulista, São Paulo - SP,Rua Jerônimo da Veiga nº 248, no 28º Subdistrito Jardim Paulista, São Paulo - SP,Rua Pedroso Alvarenga nºs 1256 e 1274, no 28º Subdistrito - Jardim Paulista, São Paulo - SP,Alameda Fernão Cardim, 70  Jardim Paulista  Estado
de São Paulo","2023-04-21"
"ARCT11","Híbrido",87.13,13.66,12.78,0.87,323093000,0,9,376.13,32.6,8.67,0,"Rodovia Washington Luis KM 198, , Corumbataí, SP, 13540-000,Av. Santos Dumont 4305, Mirassol, SP, 15135-160,Rua Professor Luciano Prata 204, São Paulo, SP, 02510-020,Av. Costa e Silva 1275, Campo Grande, MS, 79050-410,Av. Perimetral Norte 10001, Goiânia, GO, 74583-285,Rod. Juscelino Kubitscheck de Oliveira - BR 364, Frutal, MG, 38200-000,Rodovia BR 060 KM 504, Goiânia, GO, 75800-001,Rodovia BR 020 572, Caucaia, CE, 061663-015,Rodovia GO-070, Km 2 Qd. CH, Lt. 444, , Goiânia, GO, 74470-260","2023-04-21"
"ARRI11","Títulos e Val. Mob.",8.13,12.24,17.51,0.91,106147000,399178,0,0,0,0,0,"","2023-04-21"
"ASMT11","Híbrido",58,15.98,7.88,0.7,59004300,9081,3,5483.29,734,13.39,0,"Avenida Alfredo Egidio De Souza Aranha, 145, Edifício Souza Aranha I, Vila Cruzeiro, Sao Paulo/SP, Brasil, 04726-170,Avenida Independencia, 565, Imóvel Porto Alegre, Independência, Porto Alegre/RS, Brasil, 00090-035,Avenida Alfredo Egidio De Souza Aranha, 145, Edifício Souza Aranha Ii, Vila Cruzeiro, Sao Paulo/SP, Brasil, 04726-170","2023-04-21"
"ATSA11","Shoppings",70,2.47,0.5,0.86,122580000,375,1,3577.38,103.99,2.91,21.35,"Rua Giovanni Battista Pirelli, 155 - Vila Homero Thon - Santo André - SP","2023-04-21"
"BARI11","Títulos e Val. Mob.",78.95,14.63,16.5,0.82,365869000,773006,1,0,0,0,0,"","2023-04-21"
"BBFI11B","Lajes Corporativas",1415,23.51,22.15,0.65,183950000,391432,2,1976.78,532.13,26.92,0,"Rua Barao De Sao Francisco, 177, Entrada Pela Rua Gomes Braga, 65, Andarai, Rio De Janeiro/RJ, Brasil, 20560-031,Sbs Quadra 1 Bloco E Lote 24, S/n, Sem Complemento, Asa Sul, Brasilia/DF, Brasil, 70072-900","2023-04-21"
"BBFO11","Títulos e Val. Mob.",62,22.02,14.16,0.82,248242000,201654,0,0,0,0,0,"","2023-04-21"
"BBGO11","Títulos e Val. Mob.",79.5,12.03,12.45,0.81,318411000,263379,0,0,0,0,0,"","2023-04-21"
"BBPO11","Lajes Corporativas",87.19,11.77,12.35,0.87,1388040000,1385190,63,3537.59,465.42,13.16,0,"R. BENTO GONCALVES, 516, PASSO FUNDO-RS,R.XV DE NOVEMBRO,63/67, SOROCABA-SP,AV.BERNARDINO DE CAMPOS,250, SAO PAULO-SP,AV.CONSELHEIRO CARRAO,2411, SAO PAULO-SP,PCA.DAS 4 JORNADAS,11, CAMPOS DOS GOYTACAZES-RJ,ALAMEDA DOS JURUPIS, 1156, SAO PAULO-SP,R.CONDE BONFIM,369-A, RIO DE JANEIRO-RJ,R. JOAQUIM NABUCO, 246, SAO PAULO-SP,RUA HALFELD, 770 / ESQ. RUA MARECHAL DEODORO, 497, JUIZ FORA-MG,R.DR.NELSON D AVILA,149-CENTRO, SAO JOSE DOS CAMPOS-SP,PCA.CARDEAL ARCOVERDE,52, SAO CAETANO DO SUL-SP,R.JULIO CONCEICAO,438, SAO PAULO-SP,PRACA GENERAL VALADAO,377, ARACAJU-SE,R.DUQUE DE CAXIAS,725, RIBEIRAO PRETO-SP,RUA SAO BENTO, 483 / RUA LIBERO BADARO, 582, SAO PAULO-SP,PCA. RUI BARBOSA, 322, ARACATUBA-SP,AV.PRES.KENNEDY,1461, DUQUE DE CAXIAS-RJ,R.PINHEIROS,1492, SAO PAULO-SP,R.DA BAHIA,2500, BELO HORIZONTE-MG,AV.AFONSO PENA,2202, CAMPO GRANDE-MS,RUA XV DE NOVEMBRO, N. 191, SOROCABA-SP,PCA.RUI BARBOSA,1-55/R.ANT. ALVES, 9-38, BAURU-SP,AV.N.SRA.COPACABANA,594, RIO DE JANEIRO-RJ,RUA MARQUES DO HERVAL, 1354, EDIFICO SATELITE, CAXIAS DO SUL-RS,R.ESPIRITO SANTO,571, ESQ. C/ RUA CARIJÓS, 185, BELO HORIZONTE-MG,AV.ERNANI AMARAL PEIXOTO, 347, NITEROI-RJ,RUA 7 DE SETEMBRO, 1209, TOLEDO-PR,R.DR.COSTA AGUIAR,626, CAMPINAS-SP,RUA GUILHERME MOREIRA, 315, MANAUS-AM,R.VOLUNTARIOS DE S.PAULO,2975, SAO JOSE DO RIO PRETO-SP,R. FELINTO MULLER, 2104/PRES.JOSE LINHARES, 50, CUIABA-MT,AV.GOV.PEDRO DE TOLEDO,1099, CAMPINAS-SP,R.BOM PASTOR,153/169, SAO PAULO-SP,R.VOLUNTARIOS DA PATRIA,1769, SAO PAULO-SP,QD. 1, BL.G, LT. 32, BRASILIA-DF,SEPN QUADRA 504 BL B EDIFICIO VIRGO, BRASILIA-DF,PRACA XV DE NOVEMBRO, 321, FLORIANOPOLIS-SC,R.AUGUSTO RIBAS,555, PONTA GROSSA-PR,AV. GOIAS, 980 - QD.14, GOIANIA-GO,AV.SANTOS DUMONT,2889, FORTALEZA-CE,AV.13 DE MAIO,13, RIO DE JANEIRO-RJ,Praça XV de Novembro, 329, FLORIANOPOLIS-SC,AV.PRES.VARGAS,248, BELEM-PA,AV.BARTOLOMEU MITRE 438-A, RIO DE JANEIRO-RJ,R.BARORE,284, SAO PAULO-SP,R.NOSSA SENHORA DA LAPA, 281, SAO PAULO-SP,AV. AFONSO PENA, 745, ESQUINA R. QUINTINO BOCAIUVA, UBERLANDIA-MG,AV.RIO BRANCO,1437, SAO PAULO-SP,AV.DUQUE DE CAXIAS 448, MARINGA-PR,R.TAMOIOS,731/R. GUARANI, 504, BELO HORIZONTE-MG,R.HONORIO SILVEIRA DIAS,1830, PORTO ALEGRE-RS,AV.RANGEL PESTANA,2128, SAO PAULO-SP,AV.GEREMARIO DANTAS,78, RIO DE JANEIRO-RJ,R.PAULO EIRO,471/PRACA FLORIANO PEIXOTO, 254, SAO PAULO-SP,PCA.JOSE BONIFACIO,945, PIRACICABA-SP,AV W-3, Q.7, LT.7,8 E 9, BRASILIA-DF,AV.SANTA MARINA 2618, SAO PAULO-SP,AV.JABAQUARA 424, SAO PAULO-SP,PR.TIRADENTES,410/AL.DR. MURICY,760/R. CANDIDO LOP, CURITIBA-PR,R.DOMINGOS DE MORAES, 438, SAO PAULO-SP,SDN CONJ A LOJA C-03 2 PAVIMENTO, BRASILIA-DF,AV.PENHA DE FRANCA,549, SAO PAULO-SP,R.RIO DE JANEIRO,750, BELO HORIZONTE-MG","2023-04-21"
"BBRC11","Outros",93.58,12.34,12.51,0.87,148792000,108204,20,9244.63,1448.75,15.67,0,"Av. Indianópolis, 546, São Paulo-SP,Av. Prof. Francisco Morato, 1214, São Paulo-SP,Av. Portugal, 519, Santo André-SP,Av. Eng. Heitor Antônio Eiras Garcia, 3963, São Paulo-SP,Av. Prof. Francisco Morato, 2004, São Paulo-SP,Av. Amador Bueno da Veiga, 1516, São Paulo-SP,R. Pires da Mota, 488, São Paulo-SP,R. Joaquim Floriano, 666, São Paulo-SP,R. Coronel Quirino, 644, Campinas-SP,Av. Eng. Luis Carlos Berrini, 559, São Paulo-SP,Av. Santo Amaro, 2163, São Paulo-SP,Av. Gal. Pedro Pinho, 641, Osasco-SP,Al. Gabriel Monteiro da Silva, 2032, São Paulo-SP,R. Guaipá, 1389, São Paulo-SP,R. Estados Unidos, 1931, São Paulo-SP,Av. Brasil, 418, São Paulo-SP,Av. Maria Servidei Demarchi, 1662, São Bernardo do Campo-SP,Av. São Miguel, 2328, São Paulo-SP,R. Marechal Deodoro, 440, São Paulo-SP,Av. Paes de Barros, 2621, São Paulo-SP","2023-04-21"
"BBVJ11","Lajes Corporativas",62.99,0.24,0,0.96,197789000,0,1,9508,404.14,4.25,50.78,"Av. Magalhães de Castro, 4.800 - São Paulo/SP","2023-04-21"
"BCFF11","Títulos e Val. Mob.",66.69,15.53,9.99,0.93,1679680000,2070340,0,0,0,0,0,"","2023-04-21"
"BCIA11","Títulos e Val. Mob.",86.6,11.79,10.33,0.9,322069000,353742,0,0,0,0,0,"","2023-04-21"
"BCRI11","Títulos e Val. Mob.",70.17,19.49,19.23,0.71,439115000,1088380,0,0,0,0,0,"","2023-04-21"
"BICE11","Títulos e Val. Mob.",998,6.12,10.04,1.03,71135400,31699,0,0,0,0,0,"","2023-04-21"
"BICR11","Títulos e Val. Mob.",98.59,13.72,9.9,0.99,49295000,427,0,0,0,0,0,"","2023-04-21"
"BIME11","Híbrido",6.87,16.62,17.75,0.77,40159300,79585,2,1131.7,0,0,0,"Jamaris - Bairro Moema,Av. Indianópolis, 68","2023-04-21"
"BLCA11","Lajes Corporativas",110,5.96,5.9,0.79,1.76e+08,5849,1,42542.8,3032.21,7.13,0,"Avenida Brigadeiro Faria Lima, 3477, Itaim Bibi, Sao Paulo/SP, Brasil, 04538-133","2023-04-21"
"BLCP11","Logística",91,5.41,3.87,0.81,208962000,0,2,3014.16,199.89,6.63,0,"Estrada Municipal Thereza Thomazella, 432, Bairro Dos Pires, Extrema/MG, Brasil, 37640-000,Rodovia Dom Gabriel Paulino Bueno Couto, Km 80,24, Cabreuva/SP, Brasil, 13315-000","2023-04-21"
"BLMC11","Títulos e Val. Mob.",72.98,13.6,15.39,0.75,29155500,13347,0,0,0,0,0,"","2023-04-21"
"BLMG11","Outros",62.73,13.84,15.03,0.68,239038000,476752,1,287.66,57.32,19.93,0,"Cidade de Jandira, Comarca de Barueri, Estado de São Paulo.","2023-04-21"
"BLMO11","Lajes Corporativas",20999,1.34,1.79,0.63,79733200,30254,1,12324.9,461.89,3.75,0,"Av. das Nações Unidas, nº 12.901, São Paulo - SP","2023-04-21"
"BLMR11","Títulos e Val. Mob.",6.47,14.98,13.19,0.89,165254000,353239,0,0,0,0,0,"","2023-04-21"
"BLUR11","Títulos e Val. Mob.",101,0.77,12.11,1,9090000,3345,0,0,0,0,0,"","2023-04-21"
"BMLC11","Híbrido",104.19,8.59,8.72,0.92,104024000,20897,2,12936.5,1263.19,9.76,0,"Rua Lauro Muller, 116, 21º, 27º, 28º E 40º Andares, Botafogo, Rio De Janeiro/RJ, Brasil, 22290-160,Rua Joaquim Floriano, 466, Sem Complemento, Itaim Bibi, São Paulo/SP, Brasil, 04534-002","2023-04-21"
"BNFS11","Outros",111.46,14.9,15.42,1.22,78022000,73973,18,7174.9,1281.15,17.86,0,"Av. Atlantica, 537 - Rio Grande,RS,Av. Cecilio Monza, 10827 - Porto Alegre-RS,Av do Forte, 1128 - Porto Alegre-RS,Rua Maranhao 280 - Santa Maria-RS,Av. Julio de Castillhos, 303 - Sao Gabriel-RS,Rua Odorico Mosmann, 257 - Parobe-RS,Av. Venancio Aires, 1745 - Cruz Alta-RS,Av. Joao Pereira de Vargas, 1460 - Sapucaia do Sul-RS,Rua Osvaldo Aranha, 2396 - Taquari-RS,Av. 20 de Setembro, 3755 - Sapiranga-RS,Rua Baltazar Brum, 320 - Quarai-RS,Rua Jose Do Patrocinio, 165 - General Camara-RS,Rua Henrique Bier, 1125 - Sao Leopoldo-RS,Av. Assis Brasil, 657 - Arroio do Sal-RS,Rua Moreira Paz 591 - Vacaria-RS,Av. Tomaz Edison, 2615 - Sao Leopoldo-RS,Av. Flores da Cunha, 175 - Santa Rosa-RS,Av. Padre Claret 1104 - Esteio-RS","2023-04-21"
"BPFF11","Outros",61.75,19.11,12.93,0.87,277401000,344371,0,0,0,0,0,"","2023-04-21"
"BPML11","Shoppings",61.98,4.39,3.84,0.5,266829000,26597,4,3463390,673199.86,19.44,5.09,"Av. Maestro Paulo e Silva, 400, Shopping, Rio de Janeiro, RJ, 21920-445,Rua América Deolindo Garla, 224, Shopping, Lodrina, PR, 86079-225,Av. Severino Ballesteros, 850 - Cabral, Contagem - MG, 32110-005,Q. 107, Norte Avenida, NS 5, s/n, Shopping, Palmas, TO, 77001-098","2023-04-21"
"BPRP11","Outros",91.4,11.5,11.4,0.84,123375000,137,1,5346.14,639.26,11.96,0,"Avenida Pl Do Brasil, 3001, Fontes, Aruja/SP, Brasil, 07415-000","2023-04-21"
"BRCO11","Logística",100.8,8.17,7.89,0.83,1489700000,2133410,11,3344.63,316.74,9.47,12.06,"Avenida Saul Elkin, Londrina - PR,Avenida Helio Ossamu Daikuara nº 1.135, Embu da Artes - SP,Rod. BA-535. km 23, Lauro de Freitas - BA,Rua Olympia Semerano, nº 381, 675 e 7337, São Paulo - SP,Estrada Turística do Jaraguá, nº 50, Jaraguá, São Paulo - SP,Rodovia Dom Gabriel Paulino Bueno Couto, nº 1606, Itupeva - SP,Avenida Tabai-Canoas (BR 386), nº 1.200, Canoas - RS,Avenida Marginal Direita do Tietê, nº 342, São Paulo - SP,Avenida D com acesso a Rodovia Presidente Dutra, KM 298, Resende - RJ,Avenida Wilson Tavares Ribeiro, nº 1.651 - Contagem - MG,Rodovia Dom Gabriel Paulino Bueno Couto nº 1936 - Itupeva - SP","2023-04-21"
"BRCR11","Híbrido",54.85,10.51,10.27,0.55,1461110000,1343320,9,9861.61,1196.88,12.14,11.7,"Avenida Das Americas, 4200, Bloco 5, Barra Da Tijuca, Rio De Janeiro/RJ, Brasil, 22640-102,Avenida Das Nacoes Unidas, 14401, Vila Gertrudes, Sao Paulo/SP, Brasil, 04794-000,Avenida Indianopolis, 3096, Indianópolis, São Paulo/SP, Brasil, 04062-904,Avenida Doutor Chucri Zaidan, 1240, Vila Sao Francisco Zona Sul, Sao Paulo/SP, Brasil, 04711-130,Avenida Das Nações Unidas 8501, Pinheiros, São Paulo, SP, 05425-070,Avenida Henrique Valadares, 28, Centro, Rio De Janeiro/RJ, Brasil, 00020-231,Rua Volkswagen 291, São Paulo/SP, Brasill, 04344-020,Rua Verbo Divino, 1488, Chácara Santo Antônio (zona Sul), São Paulo/SP, Brasil, 04719-002,Avenida João Cabral de Mello Neto 850, Rio de Janeiro, RJ, Brasil, 22775-057","2023-04-21"
"BREV11","Híbrido",88.01,7.74,8.13,0.75,85123400,4308,13,15345.5,1417.05,9.23,0,"Alameda Itu, 852 - São Paulo/SP,Rua James Joule, 92 - São Paulo/SP,Avenida Brigadeiro Faria Lima, 3015 - São Paulo/SP,Avenida Doutor Cardoso de Melo, 1336 - São Paulo/SP,Rua Helena, 260 - São Paulo/SP,Rua Joaquim Floriano, 413 - São Paulo/SP,Rua Gomes de Carvalho, 1356 - São Paulo/SP,Rua Joaquim Floriano, 100 - São Paulo/SP,Rua Cristiano Viana, 401 - São Paulo/SP,Avenida Brigadeiro Faria Lima, 2055 - São Paulo/SP,Alameda Santos, 1940 - São Paulo/SP,Rua Tabapuã, 500,Rua Fidêncio Ramos, 213 - São Paulo/SP","2023-04-21"
"BRIM11","Residencial",1030.22,9.08,7.61,0.91,127888000,0,4,719.05,0,0,0,"Andrade Fernandes, em Alto de Pinheiros,Rua do Estilo Barroco 623-665, Chácara Santo Antônio/SP,Rua Senador Pádua Sales, Pacaembu-SP,Terreno Tumiaru, situado em rua Homônima","2023-04-21"
"BRIP11","Híbrido",909,1.18,21.28,0.94,195867000,7140,7,7413.61,0,0,0,"Rua Sebastião Paes, Campo Belo-SP,Av. das Magnólias, 682- 874- Cidade Jardim SP,Rua Guarará, Jardim Paulista- SP,Rua Ministro Ferreira Alves,294  Pompéia São Paulo - SP,Rua Dom Manuel, nº 33, São Paulo/SP,,Rua Padre Chico, Pompeia, São Paulo/SP,Jamaris - Bairro Moema
98% - BRIO MULTI","2023-04-21"
"BRLA11","Outros",158,4.37,8.18,1,484554000,101078,6,1530.17,69.48,4.54,0,"Km 101, Da Br-101, 101, Sem Complemento, , Conde/PB, Brasil, 58322-000,Rua Alexandre Barreto Cavalcante, 74, Lote 01b Quadra 07, Alterosa, Ribeirao Das Neves/MG, Brasil, 33821-105,Rua Jose Lana, 850, Sem Complemento, Brilhante I, Itajai/SC, Brasil, 88318-290,Rodovia Dos Imigrantes, Km 501, Sem Complemento, Distrito Industrial, Cuiaba/MT, Brasil, 78098-325,Estrada Ladeira Grande, S/n, Área 01-a, Parque Industrial, Viana/ES, Brasil, 29136-537,Setor 2, Setor 2, S/n, Lote 08b3, Setor 2, Lucas Do Rio Verde/MT, Brasil, 78455-000","2023-04-21"
"BTAL11","Outros",89.93,8.99,10.97,0.86,538027000,798572,9,1515.44,156.25,10.31,0,"Rodovia Br467, Br 163, Km 256.5, Jardim Europa, Toledo/PR, Brasil, 85907-060,Avenida Presidente Tancredo De Almeida Neves, 1171, Karfan, Itumbiara/GO, Brasil, 75516-475,Rodovia Br 242, Km 75, S/n, Zona Rural, Nova Ubirata/MT, Brasil, 78888-000,Rua Frutal 689, Centro, Iturama/MG, Brasil, 38280-971,Rodovia Pr 182, Km 34  Maripa/pr, Km 34,Perola Independente , Maripa/PR, Brasil, 85958-000,Estrada Da Pedreira, 151, 14 De Novembro, Cascavel/PR, Brasil, 85804-180,Rua Rio Verde, 101, Paul, Vila Velha/ES, Brasil, 29115-210,Rodovia Pr 364, Km 579, Palotina/PR, Brasil, 85950-000,Br 277, Km 533, Centro De Recebimento De Grão I.riedi, Colonia Murillo, Ibema/PR, Brasil, 85478-000","2023-04-21"
"BTCI11","Títulos e Val. Mob.",9.07,15.83,5.7,0.89,902657000,1026830,0,0,0,0,0,"","2023-04-21"
"BTCR11","Títulos e Val. Mob.",88,12.48,9.97,0.92,423289000,0,0,0,0,0,0,"","2023-04-21"
"BTLG11","Híbrido",94.36,5.11,9.38,0.96,1987870000,3774320,20,4014.21,185.81,4.63,0.51,"Rodovia Marechal Rondon, Km 536, 21500, Avenida, Aracatuba/SP, Brasil, 16027-231,Avenida Beirario, 5777, Distrito Industrial Deputado Simao Da Cunha, Santa Luzia/MG, Brasil, 33040-260,Rodovia Anhanguera, S/n, Km 308, Parque Residencial Candido Portinari, Ribeirao Preto/SP, Brasil, 14093-500,Rodovia Br470, 04, Machados, Navegantes/SC, Brasil, 88373-330,Avenida Alberto Soares Sampaio, S/n, Capuava, Maua/SP, Brasil, 09380-000,Avenida Francisco Roveri, S/n, Parque Almerinda Pereira Chaves, Jundiai/SP, Brasil, 13212-541,Rua Perola, 350, N/a, Jardim Santa Esmeralda, Hortolandia/SP, Brasil, 13186-546,Rua Dona Catharina Maria De Jesus, 400, Bonsucesso, Guarulhos/SP, Brasil, 07175-500,Estrada De Sao Goncalo, S/ Nº, Altura Aproximada Do Km 530, Humildes , Feira De Santana/BA, Brasil, 44135-000,Avenida Brigadeiro Faria Lima, 186, Pinheiros, Sao Paulo/SP, Brasil, 05426-200,Estrada Municipal Thereza Thomazella, 432, Bairro Dos Pires, Extrema/MG, Brasil, 00037-640,Estrada Ferreira Guedes, 784, Potuvera, Itapecerica Da Serra/SP, Brasil, 06885-150,Largo De Santana, 780, Santana, Sao Paulo/SP, Brasil, 02402-003,Estrada Rio Douro, 800, Mantiquira, Duque De Caxias/RJ, Brasil, 25245-810,Estrada Do Capuava, 1000, Chacara Ondas Verdes, Cotia/SP, Brasil, 06715-725,Rua Ronald Cladstone Negri, 557, Polo De Alta Tecnologia De Campinas Polo I, Campinas/SP, Brasil, 13069-472,Rodovia Ba535 Via Parafuso, Km 14, Cep 42849-000, Polo Logístico, Camacari/BA, Brasil, 42800-331,Br 116, 2271, Verife, Itaitinga/CE, Brasil, 61880-000,Rodovia Dom Gabriel Paulino Bueno Couto, Km 80,2, Esquina Com Via Dos Ipes, Bairro Do Jacaré, Cabreuva/SP, Brasil, 13315-000,Avenida Charles Goodyear, S/n, Cururuquara, Santana De Parnaiba/SP, Brasil, 06524-115","2023-04-21"
"BTRA11","Outros",80.3,12.38,12.27,0.68,270174000,567508,6,3.75,0.5,13.42,0,"Area Rural, Sn, N/a, Sao Desiderio/BA, Brasil, 47820-000,Rodovia Br 364, Km 888, Campo Novo Do Parecis/MT, Brasil, 78360-000,Zona Rural, S/n, Zona Rural, Tapurah/MT, Brasil, 78573-000,Zona Rural, S/n, Zona Rural, Nova Mutum/MT, Brasil, 78450-000,Area Rural, Sn, N/a, Nova Maringa/MT, Brasil, 78445-000,Zona Rural, S/n, Zona Rural, Campo Verde/MT, Brasil, 78840-000","2023-04-21"
"BTSG11","Híbrido",101,14.86,5.9,0.73,78276500,3522,1,4150.46,668.46,16.11,0,"Avenida dos Alecrins, 430, Distrito Industrial, Pouso Alegre, Minas Gerais, Brasil","2023-04-21"
"BTWR11","Lajes Corporativas",107,5.26,4.97,0.95,86591900,10,1,4319.91,247.68,5.73,0,"Rua Qd. B-27, Av. Dep. Jamel Cecílio, 56 - Jardim Goiás, Goiânia","2023-04-21"
"BVAR11","Outros",100.01,84.44,351.61,0.09,62560300,0,63,463.52,441.43,95.23,7.46,"Rua Manoel Correa, 76 - Centro,Av. Eduardo Ribeiro, 390 - Centro,Rua dos Americanos, 465 - Barra Funda,Rua 13 de Junho, 265 e Rua Antonio Joao, 59 (lojas 01 a 11),Rua Oswaldo Cruz, 132,Rua Sete de Setembro, 12/34 - Boa Vista,Rua Conselheiro João Alfredo, 68 - Centro,Rua dos Andradas, 1441 - Centro - Porto Alegre,Rua Marechal Deodoro, 102 - Centro,Rua Sete de Setembro, 142 - Centro,Rua do Comercio, 352 - Centro,Rua da Paz, 338 - Afogados,Rua Senador Teodoro Pacheco, 1.074 - Centro,Av. Sete de Setembro, 941-A - Centro,Rua Barão do Rio Branco, 118,Rua Imperatriz Terreza Cristina, 35 - Boa Vista,Av. Adolfo Pinheiro, 62 - Santo Amaro,Rua Major Facundo, 532 - Centro,Rua Antonio João, 59 - Lj 12 e 13 - Centro,Rua 13 de Junho, 265 - Centro,Av. Sete de Setembro, 238 - Centro,Av. Portugal, 221 - Centro,Rua Riachuelo, 360 - Centro,Pça XV de Novembro, 111,Rua Voluntários da Pátria, 29 - Centro,Rua Barão de Jundiaí, 955 - Centro,Av. Geronimo Monteiro, 299 - Centro,Pça Antonio Menck, 103 - Centro,Rua Carijós, 645 - Centro,Rua Grande, 517/523 - Centro,Rua Conselheiro João Alfredo, 38 Campina ,Rua Nova, 163 - Bairro Santo Antonio,Rua dos Andradas, 1.307 / 1.315 - Centro,Rua Regente Feijó, 1.037 - Centro,Av. Portugal, 213 - Centro,Rua da Azenha, 795 - Bairro Azenha,Av. Getulio Vargas, 258 - Centro,Rua Marechal Deodoro, 1.315 - Centro,Rua Antonio João, 59 - Lj 14 e 15 - Centro,Av. Sete de Setembro, 740 - Centro,Rua Serra Dourada, 102 - S. Miguel Paulista,Av. Paraná, 321 - Centro,Rua Visconde de Pirajá, 138 -A - Ipanema,Rua Desembargador Westphalen, 130 - Centro,Rua Dr. Deodato Wertheimer, 1.374 - Centro,Rua James Holland, 422 - Barra Funda,Rua Duque de Caxias, 222 - Santo Antonio,Rua Teodoro Sampaio, 2.382 - Pinheiros,Rua Marechal Deodoro, 900 - Centro,Rua Dias da Cruz, 155 - Meier,Rua Direita, 25 - Centro - SP,Av. Anhanguera, 5.520 - Bairro Setor Central,Av. Rio Branco, 637 - Cidade Alta,Rua Voluntários da Pátria, 167 - Centro,Av. 13 de Maio, 53 - Altos - Centro,Rua Maciel Pinheiro, 185 - Centro,Av. Presidente Kennedy, 09,Pça Ramos de Azevedo, 229,Rua João de Barros, 1812 - Encruzilhada ,Rua Candido Mendes, 1.280 - Bairro Central,Av. Senhor dos Passos, 1.167 - Centro,Rua Imperatriz Tereza Cristina, 57 - Boa Vista,Pça Dom Epaminondas, 131 - Centro","2023-04-21"
"CACR11","Híbrido",104.16,11.12,16.54,1,188262000,365477,0,0,0,0,0,"","2023-04-21"
"CARE11","Híbrido",1.9,-2.6,0,0.23,67962800,22280,1,0,0,0.39,0,"","2023-04-21"
